GO_NUCLEAR_OUTER_MEMBRANE_ENDOPLASMIC_RETICULUM_MEMBRANE_NETWORK	1124	The continuous network of membranes encompassing the nuclear outer membrane and the endoplasmic reticulum membrane. [GOC:bf, GOC:jl, GOC:mah, GOC:mcc, GOC:pr, GOC:vw]	12	0.0107	9.38E-4	1.09E-2
GO_EUKARYOTIC_TRANSLATION_INITIATION_FACTOR_4F_COMPLEX	13	The eukaryotic translation initiation factor 4F complex is composed of eIF4E, eIF4A and eIF4G; it is involved in the recognition of the mRNA cap, ATP-dependent unwinding of the 5'-terminal secondary structure and recruitment of the mRNA to the ribosome. [GOC:hb, PMID:8449919]	2	0.1538	1.02E-3	1.17E-2
GO_CLEAVAGE_FURROW	54	The cleavage furrow is a plasma membrane invagination at the cell division site. The cleavage furrow begins as a shallow groove and eventually deepens to divide the cytoplasm. [GOC:vw, ISBN:0805319409]	3	0.0556	1.05E-3	1.19E-2
GO_ENDOCYTIC_VESICLE	313	A membrane-bounded intracellular vesicle formed by invagination of the plasma membrane around an extracellular substance. Endocytic vesicles fuse with early endosomes to deliver the cargo for further sorting. [GOC:go_curators, PMID:19696797]	6	0.0192	1.09E-3	1.23E-2
GO_TRANSCRIPTION_EXPORT_COMPLEX	14	The transcription export (TREX) complex couples transcription elongation by RNA polymerase II to mRNA export. The complex associates with the polymerase and travels with it along the length of the transcribed gene. TREX is composed of the THO transcription elongation complex as well as other proteins that couple THO to mRNA export proteins. The TREX complex is known to be found in a wide range of eukaryotes, including S. cerevisiae and metazoans. [GOC:krc, PMID:11979277]	2	0.1429	1.18E-3	1.31E-2
GO_CYTOSOLIC_LARGE_RIBOSOMAL_SUBUNIT	58	The large subunit of a ribosome located in the cytosol. [GOC:mtg_sensu]	3	0.0517	1.29E-3	1.42E-2
GO_CLATHRIN_COATED_ENDOCYTIC_VESICLE	59	A clathrin-coated, membrane-bounded intracellular vesicle formed by invagination of the plasma membrane around an extracellular substance. [GOC:go_curators]	3	0.0508	1.35E-3	1.46E-2
GO_ACTIN_BASED_CELL_PROJECTION	220	A cell projection supported by an assembly of actin filaments, and which lacks microtubules. [PMID:15661519]	5	0.0227	1.35E-3	1.46E-2
GO_SITE_OF_DOUBLE_STRAND_BREAK	61	A region of a chromosome at which a DNA double-strand break has occurred. DNA damage signaling and repair proteins accumulate at the lesion to respond to the damage and repair the DNA to form a continuous DNA helix. [GOC:bf, GOC:mah, GOC:vw, PMID:20096808, PMID:21035408]	3	0.0492	1.49E-3	1.59E-2
GO_HOST_CELLULAR_COMPONENT	65	Any cellular component of a host cell. The host is an organism in which another organism, for instance a parasite or symbiont, spends part or all of its life cycle and from which it obtains nourishment and/or protection. [ISBN:0198506732]	3	0.0462	1.79E-3	1.87E-2
GO_LATERAL_PLASMA_MEMBRANE	65	The portion of the plasma membrane at the lateral side of the cell. In epithelial cells, lateral plasma membranes are on the sides of cells which lie at the interface of adjacent cells. [GOC:hb, GOC:mah, GOC:pr]	3	0.0462	1.79E-3	1.87E-2
GO_MITOCHONDRIAL_MATRIX	473	The gel-like material, with considerable fine structure, that lies in the matrix space, or lumen, of a mitochondrion. It contains the enzymes of the tricarboxylic acid cycle and, in some organisms, the enzymes concerned with fatty acid oxidation. [GOC:as, ISBN:0198506732]	7	0.0148	1.89E-3	1.95E-2
GO_COSTAMERE	19	Regular periodic sub membranous arrays of vinculin in skeletal and cardiac muscle cells, these arrays link Z-discs to the sarcolemma and are associated with links to extracellular matrix. [GOC:jl, GOC:mtg_muscle, ISBN:0198506732, PMID:6405378]	2	0.1053	2.19E-3	2.24E-2
GO_ENDOPLASMIC_RETICULUM	1429	The irregular network of unit membranes, visible only by electron microscopy, that occurs in the cytoplasm of many eukaryotic cells. The membranes form a complex meshwork of tubular channels, which are often expanded into slitlike cavities called cisternae. The ER takes two forms, rough (or granular), with ribosomes adhering to the outer surface, and smooth (with no ribosomes attached). [ISBN:0198506732]	13	0.0091	2.41E-3	2.43E-2
GO_MYOSIN_II_COMPLEX	20	A myosin complex containing two class II myosin heavy chains, two myosin essential light chains and two myosin regulatory light chains. Also known as classical myosin or conventional myosin, the myosin II class includes the major muscle myosin of vertebrate and invertebrate muscle, and is characterized by alpha-helical coiled coil tails that self assemble to form a variety of filament structures. [Wikipedia:Myosin]	2	0.1000	2.43E-3	2.43E-2


